"Epic","Feature","Story","FAILED","BROKEN","PASSED","SKIPPED","UNKNOWN"
"","Login Page","Login Successfully","0","1","1","0","0"
"","Dashboard","Checking Total User Tiles","0","0","1","0","0"
"","Dashboard","Checking Total Order Tiles","0","0","1","0","0"
"","Dashboard","Checking Inactive User Tiles","0","0","1","0","0"
"","Login Page","Login With Incorrect Username","0","0","4","0","0"
"","Dashboard","Checking Total user Active User Tiles","0","0","1","0","0"
"","Login Page","Login With Invalid Username","1","0","1","0","0"
"","Login Page","Login Unsuccessfully","0","0","2","0","0"
"","Dashboard","Checking Total Sales Tiles","0","0","1","0","0"
"","Dashboard","Checking Active User Tiles","1","0","0","0","0"
"","Dashboard","Checking Total Pending Tiles","0","0","1","0","0"
